<?xml version="1.0" encoding="UTF-8"?>
<!DOCTYPE calcio SYSTEM "calcio.dtd">
<!-- Esempi di 3 partite di calcio -->

<calcio>
	<scommessa>
		<id> 1 </id>
		<nome>
			<squadraCasa> Milan </squadraCasa>
			<squadraTrasferta> Inter </squadraTrasferta>
		</nome>
		<quotaCalcio>
      			<quota1> 2.12 </quota1>
      			<quotax> 3.55 </quotax>
      			<quota2> 1.89 </quota2>
			<quotaUnder> 1.88 </quotaUnder>
			<quotaOver> 1.74 </quotaOver>
			<quotaGG> 1.55 </quotaGG>
			<quotaNG> 1.85 </quotaNG>
     		 </quotaCalcio>
    		<ora>
			<oraInizio> 20:45 </oraInizio>
			<oraFine> 22:15 </oraFine>
		</ora>
		<data>
			<giorno> 20 </giorno>
			<mese> 03 </mese>
			<anno> 2018 </anno>
		</data>
		<puntata>
			<minima> 1 </minima>
			<massima> 9999 </massima>
		</puntata>
	</scommessa>
	<scommessa>
  		<id> 2 </id>
		<nome>
			<squadraCasa> Roma </squadraCasa>
			<squadraTrasferta> Lazio </squadraTrasferta>
		</nome>
		<quotaCalcio>
      			<quota1> 1.45 </quota1>
      			<quotax> 3.12 </quotax>
      			<quota2> 2.34 </quota2>
			<quotaUnder> 1.48 </quotaUnder>
			<quotaOver> 1.94 </quotaOver>
			<quotaGG> 1.25 </quotaGG>
			<quotaNG> 1.85 </quotaNG>
      		</quotaCalcio>
    		<ora> 
			<oraInizio> 20:45 </oraInizio>
			<oraFine> 22:15 </oraFine>
		</ora>
		<data>
			<giorno> 25 </giorno>
			<mese> 05 </mese>
			<anno> 2022 </anno>
		</data>
		<puntata>
			<minima> 1 </minima>
			<massima> 9999 </massima>
		</puntata>
	</scommessa>
	<scommessa>
  		<id> 3 </id>
		<nome>
			<squadraCasa> Juventus </squadraCasa>
			<squadraTrasferta> Torino </squadraTrasferta>
		</nome>
		<quotaCalcio>
     			<quota1> 1.35 </quota1>
      			<quotax> 3.89 </quotax>
      			<quota2> 2.89 </quota2>
			<quotaUnder> 1.88 </quotaUnder>
			<quotaOver> 1.34 </quotaOver>
			<quotaGG> 1.95 </quotaGG>
			<quotaNG> 1.25 </quotaNG>
      		</quotaCalcio>
    		<ora>
			<oraInizio> 20:45 </oraInizio>
			<oraFine> 22:15 </oraFine>
		</ora>
		<data>
			<giorno> 25 </giorno>
			<mese> 05 </mese>
			<anno> 2022 </anno>
		</data>
		 <puntata>
			<minima> 1 </minima>
			<massima> 9999 </massima>
		</puntata>
	</scommessa>
</calcio>
	
